Diet_type,Recipe_name,Cuisine_type,protein,carbs,fat,calories,fat_con,protein_con,carbs_con
keto,Sara Louise's Keto Beef Stew,american,320.1,116.95,136.22,2974.1800000000003,High,High,High
keto,"Peach Pulled Pork (Whole30, Paleo, Keto)",american,276.4,58.43,230.98,3418.1399999999994,High,High,Moderate
keto,"Raspberry Almond Chia Pudding | Keto, Vegan",british,34.91,37.2,21.84,485.0,Low,Moderate,Moderate
keto,Keto Low Carb Rosemary-garlic Croutons,american,45.96,61.58,160.76,1877.0,High,High,Moderate
keto,"Chicken and Waffles | Keto, Gluten Free",mediterranean,281.57,261.91,512.6,6787.320000000001,High,High,High
keto,Keto Single Serve Chocolate Lava Cake,american,12.25,54.31,30.22,538.22,0,Moderate,Moderate
keto,Keto Pumpkin Pie Spice Latte recipes,american,6.91,16.88,83.05,842.6099999999999,High,Low,Low
keto,Sara Louise's Keto Almond Lemon Macaroons,french,58.66,192.51,118.08,2067.4,High,High,High
keto,Keto Shredded Chicken - Mexican White Chilli,mexican,197.46,46.5,116.63,2025.5100000000002,High,High,Moderate
keto,Keto Slow Cooker Braised Oxtails recipes,american,185.39,26.71,227.55,2896.35,High,High,Low
keto,"Tuna Omelette - Low Carb, Keto, GF",french,54.44,10.68,46.53,679.25,Moderate,High,Low
keto,Keto Mini Vanilla Cloud Cakes recipes,american,69.99,144.48,236.68,2988.0,High,High,High
keto,Keto Spaghetti Squash Primavera - Low Carb,italian,33.92,34.2,67.44,879.44,High,Moderate,Moderate
keto,Keto Dutch Baby with Chocolate and Macadamia,central europe,36.97,39.12,87.22,1089.3400000000001,High,Moderate,Moderate
keto,Easy Four Cheese Pesto Zoodles - Keto,italian,139.89,240.56,195.19,3278.51,High,High,High
keto,One Minute Keto Chocolate Mug Cake,american,13.57,39.67,43.91,608.15,Moderate,Moderate,Moderate
keto,Pork & Egg Pie (Quiche) recipes,french,158.17,141.1,294.22,3845.0600000000004,High,High,High
keto,Keto Sushi Smoked Salmon Roll-Ups,nordic,51.57,14.8,64.0,841.48,High,High,Low
keto,Keto Chocolate Bacon Toffee Ice Cream,british,57.47,377.19,328.13,4691.8099999999995,High,High,High
keto,Keto Philly Cheese Steak Skillet Dinner,american,170.91,26.06,235.09,2903.69,High,High,Low
keto,KETO BEEF SHIN WITH CREAMED BRUSSELS SPROU,south american,108.95,2.93,32.08,736.24,Moderate,High,Low
keto,Homemade Queso Dip {keto / low carb},caribbean,113.94,18.23,217.03,2481.95,High,High,Low
keto,Keto Sheet Pan Curried Chicken - SCKC,american,137.45,27.93,167.71,2170.91,High,High,Low
keto,Keto Salted Chocolate Olive Oil Mousse,french,36.81,110.46,154.97,1983.81,High,Moderate,High
keto,Italian Meatball Casserole {Keto/Low Carb},italian,288.53,80.47,314.77,4308.93,High,High,High
keto,"Keto Creamy Spinach, Mushroom, and Tomato Risotto",italian,11.46,27.52,84.72,918.4000000000001,High,Moderate,Low
keto,Asian Inspired Keto Pork Chops recipes,chinese,150.08,16.64,65.35,1255.0300000000002,High,High,Low
keto,Keto Strawberry Jello Salad - Low Carb,french,53.12,73.19,213.66,2428.1800000000003,High,High,Moderate
keto,Keto Crock Pot Chocolate Cake recipes,american,67.87,92.06,253.91,2924.91,High,High,High
keto,90 SECOND KETO BREAD WITHOUT EGGY TASTE,american,19.7,7.74,38.36,455.0,Moderate,Moderate,Low
keto,5 Minute Keto Egg Drop Soup recipes,chinese,22.16,14.92,26.79,389.42999999999995,Low,Moderate,Low
keto,Keto FatHead Rolls (Almond Flour Free),south east asian,136.14,88.31,173.2,2456.6,High,High,High
keto,Keto Pork and Veggie Cauliflower Fried Rice,chinese,133.39,42.64,74.11,1371.11,High,High,Moderate
keto,Keto Matcha Crème Brûlée recipes,french,23.96,29.75,198.68,2002.96,High,Moderate,Low
keto,5-Ingredient Keto and Vegan Chocolate Almond Balls,american,49.36,85.59,132.62,1733.3799999999999,High,High,High
keto,Easy Keto Grilled Pork Chops Marinade,french,314.0,21.42,281.38,3874.1000000000004,High,High,Low
keto,Keto Grilled Radish Skewers with Herb Butter,mediterranean,2.02,7.45,46.27,454.31,Moderate,Low,Low
keto,Keto Chipotle Red Pepper Cheese Dip,south american,13.12,43.43,45.06,631.74,Moderate,Moderate,Moderate
keto,Moroccan Ketchup - Keto Spicy Tomato Dip,middle eastern,13.1,70.58,1.78,350.73999999999995,Low,Moderate,Moderate
keto,Tzatziki: Indian Style {Low Carb and Keto},mediterranean,29.68,29.92,10.49,332.81,Low,Moderate,Low
keto,Spicy Keto Deviled Eggs without Mayo,south american,53.93,28.2,92.82,1163.8999999999999,High,High,Low
keto,Low Carb Keto Green Bean Casserole,french,47.32,67.02,110.74,1454.02,High,High,Moderate
keto,Keto Instant Pot Broccoli Cheese Soup,french,106.32,105.68,180.41,2471.69,High,High,High
keto,Keto Brown Butter Pecan Ice Cream,american,38.35,93.45,389.26,4030.54,High,Moderate,High
keto,Keto Peanut Butter and Jelly Sandwiches recipes,french,18.51,9.35,32.54,404.3,Moderate,Moderate,Low
keto,Keto Grilled Lobster Tails with Creole Butter,american,114.36,5.29,97.18,1353.2200000000003,High,High,Low
keto,Keto Asian Chicken Meatballs (Nut Free),south east asian,172.75,18.9,82.14,1505.8600000000001,High,High,Low
keto,Keto Chili Cheese Dog Casserole recipes,american,243.39,72.42,346.65,4383.09,High,High,Moderate
keto,Keto Cheesy Beef taco skillet with Cauliflower,mexican,162.87,41.5,91.85,1644.13,High,High,Moderate
keto,Sara Louise's Keto Roasted Red Peppers,italian,13.56,82.23,30.98,661.98,0,Moderate,High
keto,Keto Stuffed Artichokes in the Instant Pot,mediterranean,74.08,94.95,145.35,1984.27,High,High,High
keto,Shamrock Cheesecake Bars,american,53.94,167.33,224.97,2909.81,High,High,High
keto,Low Carb Keto Chicken Parmesan Recipe,italian,306.99,25.95,216.65,3281.61,High,High,Low
keto,No-Carb Keto Chocolate Fudge - Ketogenic Dessert,french,12.44,36.18,143.93,1489.8500000000001,High,Moderate,Moderate
keto,"Instant Pot Meatloaf (Keto, Low Carb)",french,117.72,21.45,114.73,1589.25,High,High,Low
keto,Mexican Mocha Chia Seed Pudding (Keto),british,35.62,90.72,63.23,1074.4299999999998,High,Moderate,High
keto,Keto Key Lime Pie Fat Bombs,american,24.03,87.75,262.5,2809.62,High,Moderate,High
keto,Baked Keto Chicken Wings - Sweet & Spicy,south american,241.71,22.98,252.73,3333.33,High,High,Low
keto,Easy Keto Ham and Cheese Rolls Recipe,french,119.77,16.59,120.99,1634.35,High,High,Low
keto,SUGAR FREE KETO ALMOND CHOCOLATE FUDGE (Ma,italian,7.55,1.49,126.42,1173.94,High,Low,Low
keto,Keto Broccoli & Cheese Soup {low carb},french,184.47,79.17,335.24,4071.72,High,High,Moderate
keto,Delicious Bacon and Chive Keto Deviled Eggs,eastern europe,39.39,4.88,69.2,799.8800000000001,High,Moderate,Low
keto,Keto Teriyaki Turkey Rice Bowl Recipe,japanese,100.37,52.69,64.77,1195.17,High,High,Moderate
keto,Bacon Cups with Keema Beef {KETO FRIENDLY},british,151.07,19.05,293.68,3323.6,High,High,Low
keto,Keto Lamb Shanks in the Instant Pot,middle eastern,173.98,21.25,169.66,2307.86,High,High,Low
keto,Instant Pot Keto Mississippi Pot Roast,british,197.35,68.73,287.83,3654.79,High,High,Moderate
keto,3 Ingredient Keto Peanut Butter Mug Cake,british,15.19,10.34,25.3,329.82000000000005,Low,Moderate,Low
keto,Sugar and dairy free keto Easter eggs,french,17.85,111.24,298.01,3198.4500000000003,High,Moderate,High
keto,Keto Almond-Crusted Bacon and Tomato Quiche,french,150.09,58.33,420.32,4616.56,High,High,Moderate
keto,Keto Jalapeno Popper Frittata – Low Carb,french,88.72,17.21,196.03,2187.99,High,High,Low
keto,Buttered Brussels Sprouts recipes,american,125.95,93.59,266.94,3280.62,High,High,High
keto,The BEST Creamy Keto Skillet Eggs Recipe,american,70.86,7.98,100.93,1223.73,High,High,Low
keto,Sara Louise’s Keto First Spanish Omelette,mediterranean,39.65,18.22,49.19,674.1899999999999,Moderate,Moderate,Low
keto,Easy Peanut Chicken Keto Stir Fry,chinese,156.27,56.12,210.47,2743.79,High,High,Moderate
keto,Keto Mini Chicken Pot Pies recipes,american,329.1,126.32,581.0,7050.68,High,High,High
keto,"KETO FRIENDLY Cauilflower, bacon and pumpkin soup",american,35.14,46.36,97.42,1202.78,High,Moderate,Moderate
keto,Easy Bacon Cheeseburger Soup (Keto Friendl,italian,129.5,33.88,262.29,3014.13,High,High,Moderate
keto,One-Pot Keto Jambalaya with Cauliflower Rice,american,232.61,80.3,234.1,3358.54,High,High,High
keto,Okra In Spiced Yogurt {Keto Low Carb},indian,53.04,55.6,60.83,982.03,High,High,Moderate
keto,Easy Keto Turkey Fried Rice Recipe,american,111.17,53.31,72.95,1314.4700000000003,High,High,Moderate
keto,Keto Au Gratin Brussels Sprouts recipes,french,40.86,29.51,112.5,1293.98,High,High,Low
keto,Low Carb Chicken and Broccoli (Keto-Friendly),british,86.82,112.26,153.23,2175.39,High,High,High
keto,Keto and Low Carb Hamburger Casserole Recipe,american,115.63,60.1,161.99,2160.83,High,High,Moderate
keto,Sara Louise's Keto Smoked Holiday Turkey,american,1092.0,49.28,313.81,7389.41,High,High,Moderate
keto,Pressure-Cooked Keto Butternut Squash Soup,american,25.81,234.3,77.69,1739.65,High,Moderate,High
keto,Instant Pot Keto Smothered Pork Chops,french,128.37,11.05,161.84,2014.24,High,High,Low
keto,Bacon Wrapped Cheese Sticks {keto/low carb},american,58.64,6.42,162.47,1722.47,High,High,Low
keto,Keto satay chicken bowl with zoodle salad,south east asian,93.75,80.88,189.76,2406.3599999999997,High,High,High
keto,Keto Peppermint Coffee Flavor Shots (Fat Bombs),british,0.24,0.95,386.46,3482.9,High,Low,Low
keto,"Crispy Chicken Thighs | Keto, Paleo, Whole 30",italian,164.03,17.95,176.27,2314.35,High,High,Low
keto,Tuna Egg Salad with Sour Cream (Keto),american,98.33,6.68,74.47,1090.27,High,High,Low
keto,Easy Low-Carb Keto Broccoli Cheddar Soup,american,102.64,36.71,230.98,2636.22,High,High,Moderate
keto,Keto Spicy Prawn Hand Rolls recipes,british,51.15,29.26,116.43,1369.5100000000002,High,High,Low
keto,"Keto Buffalo Cauliflower Chorizo ""Mac""-N-Cheese",american,110.33,45.42,209.09,2504.81,High,High,Moderate
keto,Instant Pot® Keto Chicken and Kale Stew,french,85.08,34.62,48.18,912.42,Moderate,High,Moderate
keto,Keto Vanilla Pudding ( egg and starch free),british,24.38,19.47,96.01,1039.49,High,Moderate,Low
keto,Keto Jalapeño Popper Deviled Eggs recipes,mexican,37.05,3.73,63.0,730.12,High,Moderate,Low
keto,Easy Instant Pot® Keto Crack Chicken,american,251.8,14.6,235.28,3183.12,High,High,Low
keto,Sara Louise's Keto Cheesy Squash Casserole,italian,67.87,165.33,251.08,3192.5200000000004,High,High,High
keto,Easy Keto Lava Cake-Singe Serve,american,10.18,25.42,29.31,406.18999999999994,Low,Moderate,Low
keto,Tex Mex Chicken Salad,mexican,82.05,57.0,85.93,1329.5700000000002,High,High,Moderate
keto,KETO Mexican Melty Chicken Queso Casserole,american,341.59,41.72,253.56,3815.2799999999997,High,High,Moderate
keto,Keto Spaghetti Squash with Bacon and Blue Cheese,italian,28.81,31.47,81.97,978.85,High,Moderate,Moderate
keto,Sara Louise's Keto Instant Chicken Soup,french,455.0,72.21,444.33,6107.8099999999995,High,High,Moderate
keto,ULTIMATE KETO LOW CARB BACON CHEESE BURGER,american,23.41,10.49,70.25,767.85,High,Moderate,Low
keto,Sara Louise's Keto Grilled Chicken Fantastics,american,115.87,29.67,154.88,1976.0800000000002,High,High,Low
keto,"Air Fryer Cauliflower {Whole30, Paleo, Vegan, Keto}",american,8.73,29.85,5.77,206.25,Low,Low,Low
keto,Bacon Cabbage Chuck Roast Stew - Keto Makeover,american,338.74,43.32,399.95,5127.79,High,High,Moderate
keto,Easy Keto Chicken Shawarma - Low Carb,middle eastern,197.21,22.43,169.76,2406.4,High,High,Low
keto,Instant Pot Keto Spinach Artichoke Dip Recipe,mediterranean,124.2,51.8,296.81,3375.29,High,High,Moderate
keto,Keto Diet: Cost Breakdowns of Popular Recipes,american,227.31,27.27,430.02,4888.5,High,High,Low
keto,Crispy Keto Fried Chicken in the Air Fryer,chinese,166.09,124.39,158.29,2586.5299999999997,High,High,High
keto,"Spaghetti Squash Chow Mein | Keto, Paleo",italian,239.49,58.31,65.29,1778.81,High,High,Moderate
keto,BEST KETO ITALIAN RAGÚ aka BOLOGNES,italian,113.22,28.98,68.25,1183.05,High,High,Low
keto,Sara Louise's Keto Chicken Crack Slaw,american,136.49,53.8,144.39,2060.67,High,High,Moderate
keto,Pull-Apart Keto Pizza Bread recipes,italian,128.97,82.16,146.26,2160.8599999999997,High,High,High
keto,Vegetable beef soup keto friendly recipe,french,152.27,71.6,62.25,1455.73,High,High,Moderate
keto,SUGAR FREE KETO NEW YORK BAKED CHEESECAKE,american,22.21,13.73,42.8,528.96,Moderate,Moderate,Low
keto,"Chicken Drumsticks - Keto, paleo and under an hour",american,291.07,17.53,148.15,2567.75,High,High,Low
keto,Keto sausage egg casserole recipe (no heavy cream),american,109.7,11.65,134.41,1695.0900000000001,High,High,Low
keto,Sara Louise's Keto Baked Cauliflower Florets,mediterranean,81.75,98.68,140.13,1982.89,High,High,High
keto,"Tres Leches Cake | Keto, Gluten Free",south american,76.73,44.47,268.12,2897.88,High,High,Moderate
keto,Keto Malaysian Curry Puffs / Karipap recipes,indian,269.32,88.03,278.36,3934.6400000000003,High,High,High
keto,Keto Coconut Curry Chicken Tenders recipes,south east asian,138.13,32.21,210.53,2576.13,High,High,Moderate
keto,Keto Chicken Pot Pie - Low Carb,american,184.43,58.62,207.79,2842.31,High,High,Moderate
keto,Keto Slow Cooker Brisket Chili Recipe,american,148.04,60.43,212.34,2744.94,High,High,Moderate
keto,Keto Egg Recipe: Asiago Cheese Cloud Eggs,american,55.71,4.86,41.04,611.64,Moderate,High,Low
keto,Keto Stuffed Peppers With Cauliflower Rice Recipe,mediterranean,88.5,49.93,106.59,1513.0300000000002,High,High,Moderate
keto,Keto pork chops recipe for busy family,american,133.19,33.45,192.7,2400.8599999999997,High,High,Moderate
keto,Sara Louise's Keto Lemon Zucchini Bread,american,35.96,137.03,60.51,1236.5500000000002,High,Moderate,High
keto,Keto Tex-Mex Ground Beef Casserole,mexican,190.56,57.05,239.65,3147.29,High,High,Moderate
keto,Keto Thai Chicken Flatbread Pizza recipes,south east asian,255.67,97.13,359.99,4651.11,High,High,High
keto,Keto No Bake Noatmeal Fudge Bars recipes,american,145.02,207.35,507.65,5978.33,High,High,High
keto,Keto Eggplant Burgers Recipe (Chinese Qiezi He),chinese,55.52,40.04,53.65,865.0899999999999,Moderate,High,Moderate
keto,Low Carb & Keto-friendly Baked Onion Rings,american,55.31,46.35,45.23,813.71,Moderate,High,Moderate
keto,Pork chops keto recipe with asparagus and mushrooms,american,111.27,39.74,87.27,1389.4699999999998,High,High,Moderate
keto,"Creamy Roasted Sesame Dressing (Paleo, Whole30, Keto)",mediterranean,3.3,13.24,57.69,585.37,Moderate,Low,Low
keto,Keto Cheesy Shrimp Soup Recipe LCHF recipes,american,224.31,46.31,271.65,3527.33,High,High,Moderate
keto,"Keto Beef Tips with Mushrooms, Onions, and Gravy",french,96.76,19.16,63.61,1036.17,High,High,Low
keto,Sara Louise's Keto Turkey Zucchini Burgers,american,101.03,19.67,95.98,1346.6200000000001,High,High,Low
keto,Keto No Bake Pumpkin Pie Cheesecake recipes,american,41.06,49.82,206.62,2223.1,High,High,Moderate
keto,Keto Strawberry Mousse Cake - Low Carb,french,160.15,189.37,612.58,6911.3,High,High,High
keto,Why Salmon The Best For Keto Diet — Steemit,nordic,53.17,5.94,34.58,547.66,Moderate,High,Low
keto,Sara Louise's Keto Tunisian Spicy Tuna,south american,261.41,43.76,114.79,2253.79,High,High,Moderate
keto,Creamy Keto Cucumber Salad [5-Min Recipe],american,1.58,10.39,22.57,251.01,Low,Low,Low
keto,"Keto Salmon Curry Recipe [Paleo, Low-Carb]",nordic,100.2,30.96,104.15,1461.99,High,High,Moderate
keto,"Carrot Cake Cheesecake | Keto, Instant Pot",american,59.9,122.72,232.24,2820.64,High,High,High
keto,Keto Vegan Roasted Garlic Smashed Cauliflower | Blog,american,12.97,33.4,44.15,582.8299999999999,Moderate,Moderate,Moderate
keto,Sara Louise's Keto Chicken Fried “Rice”,chinese,134.49,45.94,83.48,1473.04,High,High,Moderate
keto,"Sausage Stuffed Portobello Mushrooms (Paleo, Whole30 + Keto)",italian,157.17,63.84,229.46,2949.18,High,High,Moderate
keto,Roasted Leeks with Eggs (Paleo and Keto-Friendly),french,24.25,58.84,242.0,2510.36,High,Moderate,Moderate
keto,Keto Adobo Air Fried Chicken Thighs Recipe,mediterranean,160.26,8.18,174.45,2243.81,High,High,Low
keto,Easy Keto Thai Skillet Chicken recipes,south east asian,118.1,70.22,178.22,2357.26,High,High,Moderate
keto,Keto Sausage and Wild Cauliflower Rice Casserole,american,127.3,106.15,219.08,2905.52,High,High,High
keto,Keto French Fries - Low Carb Jicama Fries,american,4.9,48.95,55.11,711.39,Moderate,Low,Moderate
keto,Sara Louise's Keto Louisiana Chicken Gumbo,american,189.01,102.88,274.89,3641.5699999999997,High,High,High
keto,Keto Lemon-Garlic Chicken Thighs in the Air Fryer,mediterranean,128.65,11.21,155.67,1960.47,High,High,Low
keto,Broccoli Cauliflower Soup,central europe,50.26,100.93,27.18,849.38,Low,High,High
keto,Instant Pot® Keto Pumpkin Soup with Sausage,american,60.47,72.4,107.03,1494.75,High,High,Moderate
keto,Raw Vegan Keto Strawberry Crumble (sweetener-free),american,14.11,52.65,56.69,777.25,Moderate,Moderate,Moderate
keto,Sara Louise's Keto Vegetable Meat Loaf,american,253.14,86.4,94.61,2209.6499999999996,High,High,High
keto,Giant Stuffed 3 Cheese Meatballs | Keto recipes,american,180.13,12.63,134.44,1981.0,High,High,Low
keto,Jalapeno And Cheddar Cauliflower Muffins - Keto Recipe,british,125.8,41.11,157.48,2084.96,High,High,Moderate
keto,Dark Chocolate Espresso Paleo and Keto Mug Cake,french,16.95,58.01,70.58,935.06,High,Moderate,Moderate
keto,"Whole30 + Paleo Frittata {Dairy-Free, GF, Keto}",italian,52.67,21.36,49.83,744.5899999999999,Moderate,High,Low
keto,Brown Butter Pecan Keto Ice Cream recipes,american,10.94,16.48,169.72,1637.16,High,Moderate,Low
keto,Easy Keto Low Carb Taco Soup Recipe,mexican,88.18,55.1,173.29,2132.73,High,High,Moderate
keto,Sara Louise's Keto Beef Zucchini Lasagna,italian,203.78,144.66,305.14,4140.0199999999995,High,High,High
keto,Low Carb Lemon Bar Recipe - Keto & Glu,american,52.28,59.98,273.09,2906.85,High,High,Moderate
keto,Low Carb Keto Asiago Alfredo Brussels Sprouts,italian,95.67,97.25,191.06,2491.2200000000003,High,High,High
keto,Easy Low Carb Keto Creamed Spinach Recipe,french,18.56,23.32,118.65,1235.3700000000001,High,Moderate,Low
keto,Keto Teriyaki Beef on a Stick - Low Carb,japanese,101.88,5.57,27.28,675.3199999999999,Low,High,Low
keto,Keto Egg Roll in a Bowl [Recipe] recipes,italian,96.71,72.16,111.75,1681.23,High,High,Moderate
keto,Keto Coconut Flour Tortillas/ from primaledgehealth.com,mexican,15.17,7.84,36.47,420.27,Moderate,Moderate,Low
keto,Keto Carrot Cake with Cream Cheese Frosting,american,76.43,155.74,250.22,3180.66,High,High,High
keto,Keto Gluten-Free Almond Carrot Cake recipes,british,49.48,46.71,202.89,2210.7699999999995,High,High,Moderate
keto,Keto Salmon and Creamy Turmeric Veggies recipes,nordic,156.7,68.03,160.89,2346.93,High,High,Moderate
keto,[DRESSING INGREDIENTS MISSING] Keto Mediterranean Broccoli Salad,mediterranean,27.66,71.18,25.82,627.74,Low,Moderate,Moderate
keto,"Chinese Chicken and Broccoli | Keto, Low Calorie",chinese,232.64,63.01,46.03,1596.87,Moderate,High,Moderate
keto,Instant Pot Bacon Cheddar Egg Bites (KETO),french,93.03,10.26,162.68,1877.2800000000002,High,High,Low
keto,Sara Louise's Keto Fat Bomb Lettuce Wraps,french,29.45,22.69,158.24,1632.72,High,Moderate,Low
keto,"Chinese Bamboo Salad Recipe [Paleo, AIP, Keto]",chinese,3.94,7.38,14.61,176.77,Low,Low,Low
keto,"Mini Bacon Wrapped Meatloaf (Paleo, Whole30, Keto)",american,108.19,19.83,220.57,2497.21,High,High,Low
keto,Loaded Keto Potato Dip (Low Carb Friendly),british,12.8,10.69,82.27,834.39,High,Moderate,Low
keto,Cajun Butter Steak Bites,american,134.33,16.43,171.92,2150.32,High,High,Low
keto,The Best Keto Beef Stew Crockpot Recipe,south american,229.55,90.35,76.82,1970.9799999999998,High,High,High
keto,Keto Chicken Broccoli Casserole with Cream Cheese,american,202.77,62.82,227.46,3109.5,High,High,Moderate
keto,Cabbage Soup Recipe [Keto & Low Carb] recipes,middle eastern,176.06,97.47,184.35,2753.2699999999995,High,High,High
keto,"Whole30 Ground Beef Taco Meat (Keto, Paleo)",mexican,89.43,47.16,106.19,1502.0700000000002,High,High,Moderate
keto,"Leftover Turkey Stir-fry (Paleo, Whole30 + Keto)",american,131.1,36.31,31.61,954.13,Moderate,High,Moderate
keto,Keto Waffles Stuffed with Cream Cheese [Recipe] recipes,american,28.41,3.95,81.41,862.1299999999999,High,Moderate,Low
keto,Keto Pumpkin Cheesecake with Almond Pecan Crust,american,114.22,141.2,294.77,3674.6099999999997,High,High,High
keto,"Mayo Free Deviled Eggs (Paleo, Whole30 + Keto)",italian,766.99,41.29,287.59,5821.43,High,High,Moderate
keto,Keto Chocolate Peanut Butter Mug Cake recipes,american,13.48,34.39,44.04,587.84,Moderate,Moderate,Moderate
keto,Pressure Cooker Keto Creamy Shrimp Scampi recipes,chinese,156.32,179.87,64.86,1928.5,High,High,High
keto,"Crispy Turnip Fries {Whole30, Paleo, Vegan, Keto}",american,2.93,26.02,29.02,376.98,Low,Low,Low
keto,"Creamy Asparagus Mash Recipe [Paleo, Keto, AIP]",mediterranean,5.21,12.02,13.93,194.29000000000002,Low,Low,Low
keto,Low Carb Sugar Free Keto Blueberry Muffins,american,92.13,110.8,264.5,3192.2200000000003,High,High,High
keto,Keto Broccoli Cottage cheese balls (Low carb),american,57.88,40.87,72.68,1049.1200000000001,High,High,Moderate
keto,Keto Fried Chicken {Asiago & Parmesan Breading} recipes,american,295.13,8.26,159.48,2648.88,High,High,Low
keto,Keto Air Fryer Salmon Cakes with Sriracha Mayo,nordic,106.95,10.4,128.73,1627.97,High,High,Low
keto,Vegan Keto Spaghetti Squash (Happy Thanksgiving!) recipes,american,4.32,40.55,30.4,453.0799999999999,0,Low,Moderate
keto,"Paleo Chicken Noodle Soup Recipe [AIP, Keto]",asian,57.43,33.95,53.48,846.8399999999999,Moderate,High,Moderate
keto,Southern Green Beans {Keto Friendly/Low Carb},american,19.77,76.72,45.05,791.41,Moderate,Moderate,Moderate
keto,"Keto Short Rib Ragu - Instant Pot, SCKC",french,219.27,47.01,566.84,6166.68,High,High,Moderate
keto,"Low-Carb, Keto Cheeseburger Stuffed Peppers Recipe",american,106.98,76.95,106.47,1693.95,High,High,Moderate
keto,"Flourless Pumpkin Mug Cake (Keto, Low Carb)",american,13.43,30.38,29.87,444.07,Low,Moderate,Moderate
keto,Keto Instant Pot® Soup (Low Carb),american,116.4,108.63,148.25,2234.37,High,High,High
keto,Low/Carb - Keto Friendly Cauliflower Crust Pizza,italian,219.29,29.05,302.26,3713.7000000000003,High,High,Low
keto,Simple Keto BBQ Pulled Chicken recipes,american,439.53,51.04,372.3,5312.9800000000005,High,High,Moderate
keto,"Lemon Garlic Baked Shrimp Recipe [Paleo, Keto]",mediterranean,99.82,31.72,29.53,791.93,Low,High,Moderate
keto,One-Pan Keto Chicken Breast with Vegetable Ragout,american,137.9,46.56,80.18,1459.46,High,High,Moderate
keto,"Easy Low-Carb, Keto Spinach Dip Recipe",american,84.62,30.05,163.5,1930.18,High,High,Moderate
keto,Easy Creamy Garlic Parmesan Keto Pork Chops,american,188.74,22.87,217.86,2807.1800000000003,High,High,Low
keto,Mad Creations Keto Greek Garlic Lemon Marinade,mediterranean,2.66,19.09,109.09,1068.81,High,Low,Low
keto,"Low-Carb Almond Coconut Sandies (Keto, Gluten-Free)",american,33.79,44.65,183.53,1965.53,High,Moderate,Moderate
keto,Keto Chilli Chicken | Andhra Style Chicken Recipe,french,297.22,50.45,301.39,4103.19,High,High,Moderate
keto,"Raspberry Arugula Salad Recipe [Paleo, Keto, AIP]",mediterranean,5.06,21.21,19.52,280.76,Low,Low,Low
keto,Aunt Rocky’s Crustless Quiche Lorraine (LCHF/Keto),french,71.79,35.12,138.53,1674.4099999999999,High,High,Moderate
keto,Dairy-Free Keto and Vegan Chocolate Fat Bombs,american,34.63,48.42,184.27,1990.63,High,Moderate,Moderate
keto,Sara Louise's Keto Lemon Basil Roasted Chicken,mediterranean,348.25,20.35,322.36,4375.64,High,High,Low
keto,"Homemade Ketchup Recipe | Sugar Free, Keto, and Paleo",american,8.27,42.17,1.08,211.48,Low,Low,Moderate
keto,Keto Turkey Meatballs with Sour Cream-Horseradish Dip,american,139.58,32.11,136.32,1913.6399999999999,High,High,Moderate
keto,Sara Louise's Keto Lime Cilantro Grilled Chicken,mediterranean,113.65,12.88,221.16,2496.56,High,High,Low
keto,White Chocolate Nut-Free Keto and Vegan Fat Bombs,american,0.0,0.45,218.0,1963.8,High,Low,Low
keto,Keto Diet Recipe - Bacon Wrapped Asparagus with Eggs,american,40.95,12.42,74.19,881.19,High,High,Low
keto,Low-Carb Keto Chicken “Noodle” Soup recipes,asian,171.31,285.58,77.14,2521.8199999999997,High,High,High
keto,"Chicken Alfredo Spaghetti Squash Low-Carb, Keto",italian,96.92,47.95,231.94,2666.94,High,High,Moderate
keto,"Sesame Ginger Fish Cakes (Paleo, Whole30 + Keto)",south east asian,99.21,50.6,44.65,1001.0899999999999,Moderate,High,Moderate
keto,Sara Louise's Keto Overnight Marinated Rosemary Chicken,american,142.56,10.1,171.38,2153.06,High,High,Low
keto,"Paleo Kimchi Beef Stir-Fry (Whole30, Keto)",american,66.68,45.64,31.42,732.0600000000001,Moderate,High,Moderate
keto,Keto Pumpkin Spice Haystack Cookies - Low Carb,american,21.43,49.02,245.96,2495.44,High,Moderate,Moderate
keto,Easiest Keto Meatza You’ll Ever Make! recipes,american,149.54,21.9,110.64,1681.52,High,High,Low
keto,Green Buttered Eggs - Keto and Low Carb recipes,american,23.48,6.11,53.51,599.9499999999999,Moderate,Moderate,Low
keto,Easy Keto Shrimp Scampi - Low Carb & G,chinese,127.05,39.09,61.23,1215.6299999999999,High,High,Moderate
keto,"Keto Shrimp Fried Rice [Grain-free, Paleo]",chinese,55.56,22.35,61.89,868.65,High,High,Low
keto,Instant Pot® Keto Crustless Spinach and Gouda Quiche,french,65.94,23.16,110.41,1350.09,High,High,Low
keto,Keto Faux Sous Vide Egg Bites recipes,french,143.67,18.13,200.66,2453.14,High,High,Low
keto,"Crockpot Chicken Enchilada Bowls (Paleo, Whole30 + Keto)",south american,139.86,76.81,135.28,2084.2,High,High,Moderate
keto,Keto Pecan-Crusted Pork Chops in the Air Fryer,american,184.97,22.69,183.99,2486.55,High,High,Low
keto,"Caesar Turkey Burger Bowls (Paleo, Whole30 + Keto)",american,169.12,30.04,230.99,2875.5499999999997,High,High,Moderate
keto,Aunt Rocky’s Keto Pumpkin Spice Latte (Sugar-Free),world,1.13,41.1,11.31,270.71000000000004,Low,Low,Moderate
keto,Quick and Easy Keto Sweet and Sour Sesame Chicken,chinese,77.35,14.08,103.7,1299.02,High,High,Low
keto,Slow Cooker Keto Chicken Tikka Masala recipes,indian,204.39,59.2,354.32,4243.24,High,High,Moderate
keto,"Crispy Cauliflower Salad | Paleo, Keto, Low-carb",french,35.07,72.95,78.1,1134.98,High,Moderate,Moderate
