Diet_type,Recipe_name,Cuisine_type,protein,carbs,fat,calories,fat_con,protein_con,carbs_con
vegan,Sticky toffee pear pudding,british,38.94,975.75,206.75,5919.51,High,Moderate,High
vegan,Foolproof Vegan Vanilla Coconut Ice Cream Recipe,american,22.14,253.66,219.45,3078.25,High,Moderate,High
vegan,KALE + EDAMAME DUMPLINGS w/ SIMPLE DIPPING SAUCE recipes,chinese,74.92,368.27,22.84,1978.32,Low,High,High
vegan,Vegan Quinoa-Stuffed Grilled Zucchini recipes,american,36.15,107.22,72.8,1228.6799999999998,High,Moderate,High
vegan,"Vegan, Gluten Free Butternut Squash Gratin",american,104.45,273.06,62.21,2069.93,High,High,High
vegan,Vegan Toasted Coconut And Pistachio Ice Cream,american,15.14,143.93,108.29,1610.8899999999999,High,Moderate,High
vegan,Vegan Dark Chocolate-Avocado Cake recipes,american,70.04,956.9,298.71,6796.15,High,High,High
vegan,Chana Masala Pockets with Tofu and Arugula,asian,212.76,609.53,108.18,4262.78,High,High,High
vegan,Vegan Chocolate Cake with Creamy Chocolate Filling,american,82.81,942.6,262.43,6463.51,High,High,High
vegan,Vegan Quinoa-Cranberry Stuffed Acorn Squash,american,45.69,339.78,67.84,2152.44,High,High,High
vegan,Karina's Gluten-Free Pumpkin Pie With Praline And Coconut-Pecan Crust,american,43.53,604.47,340.12,5653.08,High,High,High
vegan,Vegan Vanilla Bean Coconut Milk Ice Cream,american,17.2,154.45,180.78,2313.62,High,Moderate,High
vegan,Strawberries with Pomegranate Molasses and Vegan Whip Cream,american,16.29,206.68,134.38,2101.3,High,Moderate,High
vegan,Vegan Wild-Rice-Stuffed Butternut Squash,american,37.1,306.15,77.66,2071.94,High,Moderate,High
vegan,Vegan Seitan and Mushroom Ragù Bolognese Recipe,american,132.82,110.63,99.64,1870.56,High,High,High
vegan,Mini Vegan Key Lime Icebox Pies,american,34.73,315.21,801.39,8612.27,High,Moderate,High
vegan,Foolproof Vegan Chocolate Coconut Ice Cream Recipe,american,28.47,271.83,223.87,3216.0299999999997,High,Moderate,High
vegan,Vegan Shepherd’s Pie with Gravy recipes,american,42.83,360.03,54.61,2102.93,Moderate,High,High
vegan,Recipe: Vegan Creamy Curried Cauliflower Soup,american,32.73,97.53,95.5,1380.54,High,Moderate,High
vegan,Creamy Vegan Saag Paneer (With Tofu) Recipe,asian,50.62,81.39,62.87,1093.87,High,High,High
vegan,Spiced Butternut Squash Lentil Soup (Vegan),american,64.65,236.09,33.82,1507.3400000000001,Moderate,High,High
vegan,"Gluten-Free, Vegan Cranberry-Almond Tartlets",american,71.0,418.03,177.94,3557.58,High,High,High
vegan,Flying Tofu Wedges,asian,56.97,25.88,37.72,670.88,Moderate,High,Low
vegan,"Vegan Quinoa, Broccoli, and Kale Curry Recipe",american,42.54,161.71,55.0,1312.0,Moderate,High,High
vegan,"Vegan Coconut, Lime, and Rum Ice Cream Recipe",american,22.2,253.22,219.46,3076.82,High,Moderate,High
vegan,Easy Vegan Pressure-Cooker Miso Risotto Recipe,japanese,37.37,347.3,87.9,2329.78,High,Moderate,High
vegan,Mak Kimchi,south east asian,16.34,36.04,1.92,226.79999999999998,Low,Moderate,Moderate
vegan,Amaretto-spiked Chocolate Mousse recipes,italian,51.89,188.64,99.61,1858.61,High,High,High
vegan,"Easy Flaked Almond ""Tuna"" Salad recipes",american,36.59,50.97,86.5,1128.74,High,Moderate,Moderate
vegan,Southern Skillet Black-Eyed Peas with Quick Buttery Biscuits,mediterranean,83.85,497.26,304.42,5064.22,High,High,High
vegan,"Butternut, chestnut & lentil cake",south east asian,123.25,624.69,113.28,4011.28,High,High,High
vegan,Pink Pasta - with a creamy vegan vegetable sauce,american,63.96,356.1,16.77,1831.17,Low,High,High
vegan,Garlic Potato Kale Cakes,central europe,39.38,301.21,42.49,1744.77,Moderate,Moderate,High
vegan,Ultimate Vegan Lentil Walnut Loaf recipes,american,76.55,333.74,32.63,1934.8300000000002,Moderate,High,High
vegan,"Homemade Baileys Irish Cream, made vegan. recipes",world,8.86,93.2,117.82,1468.62,High,Low,High
vegan,"Vegan Potato, Pepper and Olive Phyllo Cups",mediterranean,65.91,373.92,94.34,2608.38,High,High,High
vegan,Barbecued Tofu Burger,asian,66.13,259.53,41.51,1676.2299999999998,Moderate,High,High
vegan,5 Ingredient No Bake Vegan Date Squares recipes,american,100.09,831.04,179.01,5335.61,High,High,High
vegan,Colin Quinn's Irish Lamb Stew recipes,british,282.7,351.37,349.13,5678.45,High,High,High
vegan,Sweet Potato-Black Bean Burgers,american,78.61,299.8,66.66,2113.58,High,High,High
vegan,Gluten- and Dairy-Free Pie Crust,american,19.84,146.62,117.59,1724.15,High,Moderate,High
vegan,Homemade Vegan Burgers That Don't Suck Recipe,american,116.52,408.38,173.73,3663.17,High,High,High
vegan,Baked mini gluten free vegan vanilla donuts,american,6.74,206.28,51.41,1314.77,Moderate,Low,High
vegan,Dark Chocolate Cherry Walnut Truffles recipes,french,29.78,210.49,152.54,2333.94,High,Moderate,High
vegan,Vegan Beet Burgers with Sweet Chili Slaw,american,55.2,303.88,59.95,1975.87,Moderate,High,High
vegan,Appetizer Recipe: Miso Sweet Potato Bites,japanese,29.62,206.76,42.3,1326.22,Moderate,Moderate,High
vegan,Vegan Snack Recipe: Toast with Hummus & Veggies,american,8.85,33.92,4.8,214.28,Low,Low,Moderate
vegan,Vegan dal | Hidden veg red lentil dal,american,80.1,235.31,7.74,1331.3,Low,High,High
vegan,Vegan Olive Oil Cake w/Candied Rosemary,american,39.73,686.82,352.54,6079.06,High,Moderate,High
vegan,Red Lentil Soup with Lime,french,53.51,161.56,19.46,1035.42,Low,High,High
vegan,Our Favorite Chocolate Cake,american,25.32,408.54,105.86,2688.1800000000003,High,Moderate,High
vegan,Who Cares Vegan Mac and Cheese recipes,american,303.66,681.96,245.27,6149.910000000001,High,High,High
vegan,"SEXY CARAMEL SLICE (RAW, VEGAN, XO) recipes",american,99.61,812.75,256.02,5953.62,High,High,High
vegan,The Saint Jamez Benedict,american,67.18,126.42,168.33,2289.37,High,High,High
vegan,Mexican Mushroom and Spinach Sandwich (Vegan Torta) Recipe,american,47.97,185.14,66.94,1534.9,High,High,High
vegan,"Vegan Mushroom ""Jerky"" (Slow-Roasted Mushroom Strips)",american,6.67,32.45,14.0,282.48,Low,Low,Moderate
vegan,Roasted Vegan Cauliflower Soup with Parsley-Chive Swirl,american,125.49,260.01,367.16,4846.4400000000005,High,High,High
vegan,Vegan “Cream” Of Broccoli Soup With Leeks And Scallions,american,27.64,114.23,30.7,843.78,0,Moderate,High
vegan,Spaghetti and Soyballs,italian,129.78,282.3,84.87,2412.15,High,High,High
vegan,Vegan Pumpkin Pie With Rustic Spelt Crust,american,50.19,470.24,154.08,3468.4400000000005,High,High,High
vegan,Raw Chili recipes,american,70.26,284.92,93.63,2263.39,High,High,High
vegan,Vegan Southern-Style Collard Greens With Mushrooms Recipe,american,55.98,115.89,160.31,2130.27,High,High,High
vegan,Organic Lentil and Rice Stuffed Peppers,mediterranean,115.69,347.98,40.9,2222.78,Moderate,High,High
vegan,Blender Sweet Potato Pie,south american,20.34,253.96,98.65,1985.0500000000002,High,Moderate,High
vegan,Vegan Hot and Sour Soup with Tofu recipes,american,81.76,53.77,82.74,1286.78,High,High,Moderate
vegan,Jackfruit Sloppy Joes,american,24.71,272.95,26.66,1430.58,Low,Moderate,High
vegan,Plain Cake Donut,american,14.5,404.4,76.58,2364.8199999999997,High,Moderate,High
vegan,"Vegan Farro Risotto with Fennel, Peas and Greens",italian,41.38,190.32,76.47,1615.03,High,High,High
vegan,Crisp Tofu and Thai Cucumber Raita,south east asian,26.96,34.41,40.89,613.49,Moderate,Moderate,Moderate
vegan,CrisSpi Asian Tofu Sandwich,asian,150.3,464.12,119.07,3529.3100000000004,High,High,High
vegan,Vegan Coconut-Lime Panna Cotta with Mango Jam,american,17.71,157.36,54.27,1188.71,Moderate,Moderate,High
vegan,Asian Asparagus Salad With Peanuts and Mint Dressing [vegan],american,35.41,104.48,84.24,1317.7199999999998,High,Moderate,High
vegan,Vegan Kale and Black Sesame Sushi Bowl,japanese,33.12,258.51,45.52,1576.2,Moderate,Moderate,High
vegan,Roasted Sweet Potato Salad with Candied Walnuts recipes,south american,18.51,117.15,64.52,1123.32,High,Moderate,High
vegan,Vegan Curry Butternut Squash Soup With Kale Recipe,american,37.46,163.3,59.63,1339.71,Moderate,Moderate,High
vegan,Vegan Cream of Mushroom and Wild Rice Soup,american,47.23,183.97,66.42,1522.58,High,High,High
vegan,Vegetarian Pasta Puttanesca,italian,54.02,303.41,75.85,2112.37,High,High,High
vegan,Baked Yam Fries with Sriracha Hummus (Vegan + GF),american,33.02,169.41,42.68,1193.8400000000001,Moderate,Moderate,High
vegan,Corn Soup with Tofu Larb,asian,88.69,267.57,77.5,2122.54,High,High,High
vegan,"Tomato, pepper & bean one pot",mexican,161.21,531.46,26.21,3006.57,Low,High,High
vegan,THE BEST VEGAN CORN TACOS WITH BELL PEPPER AND CILANTRO,american,19.99,144.88,41.58,1033.7,Moderate,Moderate,High
vegan,Basil Scalloped Tomatoes and Croutons recipes,american,40.71,83.13,49.37,939.69,Moderate,High,High
vegan,"Carrot, Pea, and Mint Salad Recipe",mediterranean,17.22,75.91,82.92,1118.8,High,Moderate,Moderate
vegan,Beet and Citrus Salad With Pine Nut Vinaigrette Recipe,american,24.74,156.71,107.6,1694.2,High,Moderate,High
vegan,Stir Fried Singapore Noodles with Garlic Ginger Sauce recipes,asian,35.17,166.07,18.47,971.19,Low,Moderate,High
vegan,Easy Vegan Soba Noodles with Peanut Sauce Recipe,asian,100.27,392.87,70.17,2604.09,High,High,High
vegan,"Eat your veggies, risotto!",italian,57.83,172.85,39.19,1275.43,Moderate,High,High
vegan,Vegan Coconut Cream Tart with White Peaches and Blueberries,american,39.45,285.88,109.49,2286.73,High,Moderate,High
vegan,Tomato-Garlic Focaccia - My Vegan Italian Flatbread,american,29.81,323.46,24.1,1629.98,Low,Moderate,High
vegan,Gluten-Free Low-Fat Vegan Oatmeal Muffins Recipe,american,36.6,395.9,52.33,2200.97,Moderate,Moderate,High
vegan,Light Yakisoba Noodles,asian,26.81,120.31,35.64,909.24,Moderate,Moderate,High
vegan,Barbecue Slawpy Jacks,american,28.7,376.7,56.48,2129.92,Moderate,Moderate,High
vegan,Gigante Beans a la Zaytinya,american,29.56,98.08,46.07,925.19,Moderate,Moderate,High
vegan,Vegan Chickpea Chile Soup with Greens and Grains,american,56.37,226.91,31.65,1417.9699999999998,Moderate,High,High
vegan,Vegan Garden Pesto With Miso and Mixed Herbs Recipe,american,10.74,18.94,124.83,1242.19,High,Moderate,Low
vegan,Fig Salad inspired by Yotam Ottolenghi,american,22.07,156.75,49.11,1157.27,Moderate,Moderate,High
vegan,Seared Maitake Mushrooms recipes,french,13.6,57.03,197.0,2055.52,High,Moderate,Moderate
vegan,Cheater’s Maple Baked Beans on Toast recipes,american,34.0,133.4,9.01,750.69,Low,Moderate,High
vegan,Chickpea Salad recipes,american,35.34,109.62,26.9,821.94,Low,Moderate,High
vegan,The Vegan Divas Cookbook: Smoky Tomato-Bean Soup,american,70.3,187.93,32.62,1326.5,Moderate,High,High
vegan,Mexican Fried Eggplant Sandwich (Vegan Tortas and Pambazos) Recipe,american,61.37,316.97,274.04,3979.7200000000003,High,High,High
vegan,Summer tomato lazy bruschetta,italian,37.03,180.61,44.77,1273.49,Moderate,Moderate,High
vegan,"""Refried"" Black Beans and Walnut Meat Tacos (Vegan)",american,133.18,332.91,127.84,3014.92,High,High,High
vegan,Vegan Roasted Vegetable Quinoa Bowl with Creamy Green Sauce,american,56.14,170.34,81.83,1642.39,High,High,High
vegan,Herb and Cheese Drop Biscuits recipes,british,36.3,205.92,94.25,1817.1299999999999,High,Moderate,High
vegan,"Vegan Eggnog (Dairy Free, Egg Free, Gluten Free)",american,91.05,155.31,215.85,2928.09,High,High,High
vegan,Butternut Squash Salad With Farro And Pepitas recipes,italian,67.75,229.64,124.65,2311.41,High,High,High
vegan,"Vegan raw corn, avocado and black bean salad",american,44.72,195.48,34.04,1267.1599999999999,Moderate,High,High
vegan,Vegan Chocolate Layer Cake With Creamy Chocolate Filling,american,82.81,942.6,262.43,6463.51,High,High,High
vegan,Seared Maitake Mushrooms,french,13.34,55.4,196.91,2047.15,High,Moderate,Moderate
vegan,Chive Vegan Cheese Spread and Veggie Crackers recipes,american,138.65,214.34,302.54,4134.82,High,High,High
vegan,Zucchini Gratin,french,48.89,133.58,108.22,1703.8600000000001,High,High,High
vegan,Salmon Burgers with Tartar Sauce,nordic,172.89,109.41,191.28,2850.72,High,High,High
vegan,Vegan Huevos Rancheros Are 10/10 Would Make Again,american,93.69,284.36,66.49,2110.61,High,High,High
vegan,Whole Wheat Eggless Garlic Bread Rolls,american,95.06,500.82,65.36,2971.76,High,High,High
vegan,French Apple Tart (Tarte Fine aux Pommes) [vegan],american,5.76,154.65,42.27,1022.0699999999999,Moderate,Low,High
vegan,Toasted Coconut Chocolate Cream Pie,american,96.57,276.56,234.17,3600.0499999999997,High,High,High
vegan,Vegan Pesto Spaghetti Squash with Mushrooms & Sun-Dried Tomatoes,american,30.43,110.1,81.2,1292.92,High,Moderate,High
vegan,Pasta e fagioli,italian,100.0,327.59,46.54,2129.22,Moderate,High,High
vegan,The Whole Wheat,american,80.52,395.26,102.03,2821.39,High,High,High
vegan,"Eggplant, Mushroom & Pesto Pizza recipes",italian,66.43,309.21,113.02,2519.74,High,High,High
vegan,Rotini Tomato Pasta with 3 Minute Vegan Parmesan Cheese recipes,american,28.77,26.8,36.72,552.76,Moderate,Moderate,Low
vegan,Portobello Sliders with Pepita Pesto,american,67.2,211.29,116.76,2164.8,High,High,High
vegan,Savory Vegan Chickpea Crêpes with Spring Vegetable Ragout,american,47.23,162.33,31.12,1118.32,Moderate,High,High
vegan,Slow-Cooker Vegan Butternut Squash Soup with Apple,american,49.4,225.93,112.78,2116.34,High,High,High
vegan,Vegan: Japanese Simmered Daikon with Bok Choy and Edamame Recipe,world,22.13,75.04,6.6,448.08,Low,Moderate,Moderate
vegan,Grilled Broccoli And Bread Salad With Pickled Shallots,american,42.75,263.75,130.8,2403.2,High,High,High
vegan,"Green Bean Casserole (The Vegan, Gluten Free Sequel)",american,37.46,211.74,147.84,2327.36,High,Moderate,High
vegan,Vegan Crispy Stir-Fried Tofu With Broccoli Recipe,asian,67.23,204.3,282.72,3630.6000000000004,High,High,High
vegan,Vegan Stuffed Squash with Brown Rice and Mushrooms recipes,american,70.59,564.75,78.83,3250.83,High,High,High
vegan,Quinoa chilli with avocado & coriander,south american,63.63,199.77,62.16,1613.04,High,High,High
vegan,Aloo Gobi,indian,26.33,176.83,12.93,929.0100000000001,Low,Moderate,High
vegan,Apple-Cranberry Cobbler,american,88.21,772.5,75.84,4125.400000000001,High,High,High
vegan,"From the Pantry: Vegan Pear, Cranberry and Pecan Muffins",american,31.57,444.44,162.63,3367.71,High,Moderate,High
vegan,Springtime Strawberry Lime Mango Crisp (Vegan + GF) recipes,american,48.9,300.82,142.18,2678.5,High,High,High
vegan,Gluten-Free Tuesday: Vegan Apple Doughnuts Recipe,american,29.04,712.15,210.64,4860.5199999999995,High,Moderate,High
vegan,The Most Delicious Vegan Pad Kee Mao Recipe,american,86.42,497.8,386.06,5811.42,High,High,High
vegan,Vegan Seared Pepper Tacos With Pintos And Avocado Crema,american,25.68,158.11,103.65,1668.0100000000002,High,Moderate,High
vegan,Charred aubergines with white beans & salsa verde,mexican,100.96,337.54,186.26,3430.34,High,High,High
vegan,Yogurt Pancakes with Clementine Raspberry Compote,american,26.62,228.04,54.43,1508.51,Moderate,Moderate,High
vegan,Curried Carrot Ginger Soup,indian,27.43,175.59,121.69,1907.29,High,Moderate,High
vegan,Tomato Bisque with Cashew Cream,mediterranean,63.64,156.49,170.3,2413.2200000000003,High,High,High
vegan,"Apple, Pear, And Sage Pie With Maple Walnut Crunch And Salted Honey Yogurt",american,77.2,673.23,194.71,4754.110000000001,High,High,High
vegan,Crunchy Summer Salad with Creamy Vegan Avocado Dressing,american,65.41,268.37,97.67,2214.1499999999996,High,High,High
vegan,RAW VEGAN TIRAMISU with VANILLA CREAM & COFFEE LADYFINGERS recipes,american,102.51,578.68,263.97,5100.49,High,High,High
vegan,"Oatmeal, Fig, and Walnut Bars",american,73.43,1059.84,223.88,6548.0,High,High,High
vegan,Chickpea Miso Gravy Bowl with Sweet and Tangy Portobello Mushrooms recipes,japanese,32.73,191.92,39.61,1255.09,Moderate,Moderate,High
vegan,"Oatmeal, Fig, And Walnut Bars",american,54.06,916.76,219.49,5858.69,High,High,High
vegan,Vegan Spinach and Hominy Enchiladas With Spicy Cashew Cream Recipe,american,95.94,460.5,120.71,3312.15,High,High,High
vegan,Crabless Cakes with Hearts of Palm & Corn recipes,american,34.41,152.22,43.18,1135.1399999999999,Moderate,Moderate,High
vegan,"Braised Red Cabbage (Rotkraut) - (Vegan, Gluten Free, Low Fat)",american,19.6,91.74,39.84,803.9200000000001,Moderate,Moderate,High
vegan,High Protein Quinoa Almond Berry Salad (Vegan & GF) recipes,american,39.67,220.91,45.97,1456.05,Moderate,Moderate,High
vegan,Nut Meat Tacos with Pickled Red Onions,american,43.71,165.56,91.56,1661.12,High,High,High
vegan,"Zucchini Noodles with Roasted Tomato Sauce (Gluten-Free, Vegan)",american,22.79,88.69,39.57,802.05,Moderate,Moderate,High
vegan,End Of Summer Peach Apple Cobbler (Gluten-Free & Vegan),american,25.99,293.33,56.32,1784.1599999999999,Moderate,Moderate,High
vegan,"Cranberry, Apricot And Pecan Wild Rice Pilaf (Gf + Vegan)",american,36.91,263.46,75.99,1885.3899999999999,High,Moderate,High
vegan,Fried Eggplant Sandwich With Eggplant Mayo Recipe,mediterranean,60.32,323.46,333.19,4533.83,High,High,High
vegan,Overnight Cherry Chia Seed Pudding – Paleo/Gluten Free/Vegan,american,12.77,112.92,56.84,1014.32,Moderate,Moderate,High
vegan,Fernanda Capobianco’s Pissaladière with Vegetables and Olives,french,43.32,292.33,229.46,3407.74,High,High,High
vegan,Vegan Lentil Shepherd’s Pie With Parsnip And And Potato Mash,american,123.18,591.98,66.46,3458.78,High,High,High
vegan,Ruby and Emerald Jeweled Rice,american,71.39,635.59,83.8,3582.12,High,High,High
vegan,Creamy Penne Pasta Bake With Zucchini,italian,72.39,391.05,92.19,2683.4700000000003,High,High,High
vegan,Quinoa Greek Salad recipes,mediterranean,40.99,145.69,88.66,1544.6599999999999,High,High,High
vegan,Pumpkin Polenta Recipe With Tomatillo-Avocado Salsa,south american,25.55,215.41,94.48,1814.16,High,Moderate,High
vegan,Gluten-Free Black Bean Burgers,south east asian,167.98,551.67,21.39,3071.1099999999997,Low,High,High
vegan,Creamy Polenta with Tempeh Sausage and Tomatoes,american,149.12,256.35,113.0,2638.88,High,High,High
vegan,Pineapple and Shrimp Fried Quinoa recipes,south east asian,88.52,225.53,98.9,2146.3,High,High,High
vegan,STRAWBERRY + CHOCOLATE CHEESECAKE recipes,american,90.62,426.23,303.42,4798.18,High,High,High
vegan,French Toast with Caramelized Bananas (Vegan and Gluten-Free) recipes,american,30.81,252.81,116.54,2183.34,High,Moderate,High
vegan,Black Bean And Butternut Squash Burritos,mexican,80.91,322.43,60.9,2161.46,High,High,High
vegan,Jicama and Pomelo Salad With Spicy Thai Dressing (Vegan) Recipe,south east asian,20.97,83.67,19.59,594.87,Low,Moderate,High
vegan,Recipe: Best-Ever Veggie Burger,american,78.27,305.53,27.28,1780.7199999999998,Low,High,High
vegan,Red Lentil Spaghetti With Vegan Cauliflower Rosa Sauce and Arugula,american,68.96,372.57,26.63,2005.79,Low,High,High
vegan,Dried Olive and Miso Shake (The Best Vegan Parmesan Substitute) Recipe,american,12.55,40.94,74.64,885.72,High,Moderate,Moderate
vegan,Vietnamese-Style Tofu Hero with Asian Slaw,south east asian,49.71,65.14,96.03,1323.67,High,High,Moderate
vegan,"A Recipe For Long Grain Brown Rice Pilaf (Vegan, Gluten Free)",mediterranean,43.94,188.1,47.11,1352.15,Moderate,High,High
vegan,Hazelnut Fig Crackers with Sage and Black Pepper,american,167.2,358.87,455.11,6200.27,High,High,High
vegan,crunchy quinoa & veggie roaster,american,47.61,172.48,94.06,1726.8999999999999,High,High,High
vegan,Chocolate Cake with Chocolate-Orange Frosting,american,37.4,726.63,235.54,5175.98,High,Moderate,High
vegan,Aloo Gobi,indian,27.03,181.02,31.83,1118.67,Moderate,Moderate,High
vegan,Vegan Olive Oil Cake (adapted from Maialino's Olive Oil Cake),american,59.98,595.67,315.33,5460.57,High,High,High
vegan,Cashew Cheesecake,american,87.42,376.41,316.17,4700.85,High,High,High
vegan,Creamy Coconut & Roasted Beet Soup with Pistachios & Greek Yogurt,mediterranean,53.36,194.74,139.46,2247.54,High,High,High
vegan,"Pasta With Snap Peas, Garlic, Lemon Zest, and Black Pepper (Vegan) Recipe",american,43.66,212.0,58.57,1549.77,Moderate,High,High
vegan,Curried Chickpea Sandwich,indian,81.73,310.6,118.26,2633.6600000000003,High,High,High
vegan,"Gluten-Free, Vegan, and Oil-Free Walnut Chip Brownies recipes",american,48.32,425.34,81.89,2631.6499999999996,High,High,High
vegan,Gluten Free Green Bean Casserole,south east asian,101.87,445.89,688.94,8391.5,High,High,High
vegan,Cashew cream fettuccine Alfredo with sauteed spinach and cheese crisps (gluten-free),italian,134.51,486.89,259.0,4816.6,High,High,High
vegan,"Vegan Peanut, Sweet Potato, and Kale Soup With Coconut Recipe",american,102.57,257.64,466.14,5636.1,High,High,High
vegan,Maple-Glazed Sweet Potatoes (Japanese Daigaku Imo Style) w/Vegan option,american,9.74,183.18,83.83,1526.15,High,Low,High
vegan,Sweet Potato and Mushroom Cannelloni with Braised Escarole and Butter Beans (Vegan) Recipe,american,98.62,443.0,40.15,2527.83,Moderate,High,High
vegan,"A Recipe for Long Grain Brown Rice Pilaf (Vegan, Gluten Free)",mediterranean,31.85,171.16,41.35,1184.19,Moderate,Moderate,High
vegan,Creamy Zucchini Soup With Scallions And Brazil Nut Chili Oil (Vegan),american,18.0,47.86,115.43,1302.3100000000002,High,Moderate,Moderate
vegan,20 Minute Apple Turnovers,french,10.46,194.67,32.94,1116.98,Moderate,Moderate,High
vegan,"Fat Tommy’s Three-Bean, Gluten-Free, Vegan Chili Recipe",american,171.0,580.93,51.33,3469.6899999999996,Moderate,High,High
vegan,"Cumin Scented Kale with Onions, Tomatoes and Mushrooms (Vegan and Gluten Free)",american,23.34,55.86,6.25,373.05,Low,Moderate,Moderate
vegan,Grilled Marinated Heart of Palm Tacos With Spicy Cabbage Slaw (vegan) Recipe,american,37.49,199.1,58.73,1474.9299999999998,Moderate,Moderate,High
vegan,"Spicy, Smoky Bean Cakes with Lime Slaw and Charred Avocado Recipe",south american,66.35,249.4,71.01,1902.0900000000001,High,High,High
vegan,Curried Lentils with Quick-Pickled Veggies,indian,225.55,590.44,50.12,3715.04,Moderate,High,High
vegan,Whole-Grain Vegan Carrot Cake Loaf with Lemon Glaze recipes,american,49.39,381.92,102.7,2649.54,High,High,High
vegan,Chocolate Cake with Chocolate-Orange Frosting recipes,american,37.4,726.63,235.54,5175.98,High,Moderate,High
vegan,Hearty Vegan Polenta and Kale Soup With Miso and Toasted Sesame Oil Recipe,japanese,23.03,167.07,101.79,1676.51,High,Moderate,High
vegan,Mushroom and Eggplant Veggie Burgers,nordic,118.09,385.66,106.3,2971.7,High,High,High
vegan,Blissful Blueberry Banana Spelt Muffins (vegan + refined sugar-free) recipes,american,63.99,445.42,104.56,2978.6800000000003,High,High,High
vegan,Pesto Knots,american,67.14,203.94,87.54,1872.1799999999998,High,High,High
vegan,J. Kenji López-Alt's 15-Minute Creamy (Vegan) Tomato Soup,american,27.5,129.28,116.19,1672.83,High,Moderate,High
vegan,Southwestern Crispy Fish Taco Salad,american,115.47,258.63,243.6,3688.8,High,High,High
vegan,Sinless Sticky Toffee Pecan Pudding recipes,british,26.85,625.68,137.41,3846.81,High,Moderate,High
vegan,Kentucky fried seitan,mediterranean,317.43,703.99,534.41,8895.369999999999,High,High,High
vegan,Quinoa Maki with Avocado and Cajun Portobello Fillets,american,30.0,115.55,99.36,1476.44,High,Moderate,High
vegan,Indian Stuffed Eggplant,mediterranean,66.39,327.51,151.81,2941.89,High,High,High
vegan,"Spicy Peanut Noodle Salad With Cucumbers, Red Peppers, and Basil (Vegan) Recipe",american,97.38,284.55,128.74,2686.38,High,High,High
vegan,Vegan Pumpkin Pie Squares with Gluten-Free Graham Cracker Crust recipes,american,12.97,240.28,95.85,1875.65,High,Moderate,High
vegan,Lemon Glazed Spice Cake With Whipped Cream,american,29.85,482.83,78.11,2753.71,High,Moderate,High
vegan,Cozy Yellow Curry Vegetable Soup,indian,46.9,136.01,90.04,1542.0,High,High,High
vegan,"Japanese Udon With Mushroom-Soy Broth, Stir-Fried Mushrooms, and Cabbage (Vegan) Recipe",american,6.82,20.1,3.16,136.12,Low,Low,Low
vegan,"Tempeh, Pepper, and Spinach-Pesto Sandwich",mediterranean,88.15,164.82,78.16,1715.32,High,High,High
vegan,Sweet potato & black bean chilli with zesty quinoa,south american,70.17,302.2,66.07,2084.1099999999997,High,High,High
vegan,"ULTIMATE RAW VEGAN PIZZA (LOW-FAT, OIL-FREE, SALT-FREE) recipes",italian,26.97,147.83,5.81,751.49,Low,Moderate,High
vegan,"Oven Roasted Portobello Mushrooms marinated in Balsamic (Vegan, Gluten Free) Vinegar, Shallots and Thyme",american,10.23,86.04,1.3,396.78000000000003,Low,Moderate,High
vegan,Yellow Split Pea Soup recipes,french,122.34,325.46,68.41,2406.89,High,High,High
vegan,Banana-Coconut Cake Recipe,caribbean,55.36,1063.72,621.42,10069.099999999999,High,High,High
vegan,Party Vegan's Porcini-stuffed Seitan with Wild Mushroom Sauce Recipe,american,273.14,433.03,89.55,3630.6299999999997,High,High,High
vegan,Steamed Buns with Tempura King Oyster Mushrooms and Agave-Miso Mayonnaise (Vegan) Recipe,japanese,75.31,498.92,898.55,10383.869999999999,High,High,High
vegan,Mexican Chocolate Cake,mexican,37.67,460.63,87.47,2780.4300000000003,High,Moderate,High
vegan,"All the Veggies In Your Fridge, Stir-Fry (Low Oil, Vegan, GF)",american,10.96,123.44,15.73,679.1700000000001,Low,Moderate,High
vegan,CHIPOTLE JACKFRUIT TACOS WITH SIMPLE GUAC AND LEMON ORANGE CREMA,mexican,35.85,463.12,106.43,2953.75,High,Moderate,High
vegan,Crispy Bánh Mì Spring Rolls With Creamy Chili Mayo Recipe,american,12.93,389.9,1831.34,18093.379999999997,High,Moderate,High
vegan,"Mediterranean White Beans with Sun Dried Tomatoes, Mushrooms, Garlic and Thyme (vegan, gluten free)",american,96.57,251.63,30.86,1670.54,0,High,High
vegan,The Ultimate Rich and Creamy Vegan Ramen With Roasted Vegetables and Miso Broth Recipe,japanese,3.4,15.57,9.12,157.95999999999998,Low,Low,Low
vegan,Jeweled Rice (Iranian / Persian Morausa Polo),middle eastern,66.05,572.85,202.78,4380.62,High,High,High
vegan,Ginger-Apple Crumble Pie (Gluten And Dairy-Free),american,43.69,447.5,213.05,3882.21,High,High,High
vegan,"Look Ma No Dairy! - Creamy Parnsnip Soup with Granny Smith Apples (Vegan, Gluten Free)",american,125.36,322.67,170.22,3324.1000000000004,High,High,High
vegan,Sassy Springtime Rolls,south east asian,53.3,189.63,35.99,1295.63,Moderate,High,High
